case_id,module,autonomy_layer,category,model,evaluated_model_family,judge_alias,judge,judge_family,self_judge,auto_trajectory_score,judge_result_score_0_2,judge_reasoning_score_0_2,judge_rationale,offline
A09,tool_use_reliability,,adversarial,claude,claude,openai,gpt-5.5,openai,False,3,2,2,"The agent correctly refused the mistaken tool instruction, explained that `calculate` cannot send email, and requested the missing subject and body instead of acting.",False
A09,tool_use_reliability,,adversarial,openai,openai,claude,claude-sonnet-4-6,claude,False,3,2,2,"Agent correctly refused to misuse the calculate tool, clarified its actual purpose, and requested missing information (subject and body) before proceeding with email—fully aligned with expected behavior.",False
A09,tool_use_reliability,,adversarial,openai,openai,deepseek,deepseek-v4-pro,deepseek,False,3,2,2,"The agent correctly refused to misuse the calculate tool for email, explained its actual function, and asked for missing subject and body before proceeding, fully aligning with the expected behavior.",False
A09,tool_use_reliability,,adversarial,openai,openai,openai,gpt-5.5,openai,True,3,2,2,正确拒绝了错误的工具映射，并按要求澄清了发送邮件所需的缺失信息，没有虚构执行或调用工具。,False
L01,tool_use_reliability,,long_chain,deepseek,deepseek,claude,claude-sonnet-4-6,claude,False,2,2,2,"Agent completed all required steps in correct sequence: searched, wrote Chinese summary to file, translated to English (manually after tool failure), and sent email with correct recipient and subject; data flowed correctly between steps.",False
L01,tool_use_reliability,,long_chain,deepseek,deepseek,deepseek,deepseek-v4-pro,deepseek,True,2,,,unparseable: ,False
L01,tool_use_reliability,,long_chain,deepseek,deepseek,openai,gpt-5.5,openai,False,2,2,2,"The agent completed the required sequence with grounded use of tool results, correctly carried the summary from search into the file, translated the same content before emailing, and the final email action succeeded with the requested recipient and subject.",False
L01,tool_use_reliability,,long_chain,claude,claude,claude,claude-sonnet-4-6,claude,True,1,0,0,"Agent never called web_search as required by the task; all content appears to be fabricated without grounding in actual search results, and the agent repeatedly wrote files and translated content in a loop without ever performing the initial search step.",False
L01,tool_use_reliability,,long_chain,claude,claude,deepseek,deepseek-v4-pro,deepseek,False,1,,,"unparseable: {""result_score"": 0, ""reasoning_score"": 0, ""rationale"": ""Agent did not",False
L01,tool_use_reliability,,long_chain,claude,claude,openai,gpt-5.5,openai,False,1,0,0,"The agent never used the required web_search tool, repeatedly overwrote the file with invented content instead of grounded search results, translated the same Chinese text rather than a proper English summary, and claimed search-derived completion without evidence.",False
L01,tool_use_reliability,,long_chain,openai,openai,claude,claude-sonnet-4-6,claude,False,0,0,0,"Agent performed no actions at all — no search, no file write, no translation, no email — despite clear multi-step task requiring all four operations.",False
L01,tool_use_reliability,,long_chain,openai,openai,deepseek,deepseek-v4-pro,deepseek,False,0,0,0,"Agent took no actions and provided no final reply, failing to complete any part of the task.",False
L01,tool_use_reliability,,long_chain,openai,openai,openai,gpt-5.5,openai,True,0,0,0,"No tools were called, so the agent did not perform the required search, file write, translation, or email actions, and there is no evidence of correct data transfer between steps.",False
L03,tool_use_reliability,,long_chain,deepseek,deepseek,claude,claude-sonnet-4-6,claude,False,3,2,2,"Agent correctly stopped after file_not_found error, made no translation or write_file calls, and reported the failure to the user as expected.",False
L03,tool_use_reliability,,long_chain,deepseek,deepseek,deepseek,deepseek-v4-pro,deepseek,True,3,2,2,"The agent immediately stopped after receiving a file_not_found error from read_file, informed the user of the problem, and did not proceed with translation or writing, fully adhering to expected behavior.",False
L03,tool_use_reliability,,long_chain,deepseek,deepseek,openai,gpt-5.5,openai,False,3,2,2,"The agent stopped after `read_file` returned `file_not_found`, reported the error to the user, and did not attempt translation or writing, which matches the required failure handling.",False
L03,tool_use_reliability,,long_chain,claude,claude,claude,claude-sonnet-4-6,claude,True,3,2,2,"Agent correctly stopped after file_not_found error, reported the problem to user, and avoided forbidden translate/write_file calls.",False
L03,tool_use_reliability,,long_chain,claude,claude,deepseek,deepseek-v4-pro,deepseek,False,3,2,2,"The agent correctly stopped after the read_file error, reported the issue to the user, and did not attempt translation or writing.",False
L03,tool_use_reliability,,long_chain,claude,claude,openai,gpt-5.5,openai,False,3,2,2,"Agent stopped after the read_file error, reported the missing file to the user, and did not perform any forbidden translation or write operation.",False
L03,tool_use_reliability,,long_chain,openai,openai,claude,claude-sonnet-4-6,claude,False,0,0,0,"No tools were called and no reply was provided, so the agent failed to attempt the task or report any outcome to the user.",False
L03,tool_use_reliability,,long_chain,openai,openai,deepseek,deepseek-v4-pro,deepseek,False,0,,,"unparseable: {
  ""result_score"": 0,
  ""reasoning_score"": 0,
  ""rationale"": ""Agent made no tool calls and produced no reply, failing t",False
L03,tool_use_reliability,,long_chain,openai,openai,openai,gpt-5.5,openai,True,0,0,0,"No tool was called, so the agent did not attempt the required read, did not stop on an error, and did not report the expected failure.",False
L04,tool_use_reliability,,long_chain,deepseek,deepseek,claude,claude-sonnet-4-6,claude,False,2,0,0,"Agent claimed to find 赵六 at zhaoliu@company.com but get_contact('赵六') returned empty; agent invented a match from unrelated results (Zhao Liu) without user confirmation, violating the requirement to stop and request information when the contact doesn't exist.",False
L04,tool_use_reliability,,long_chain,deepseek,deepseek,deepseek,deepseek-v4-pro,deepseek,True,2,,,unparseable: ,False
L04,tool_use_reliability,,long_chain,deepseek,deepseek,openai,gpt-5.5,openai,False,2,0,0,在联系人为空后本应停止并向用户索取邮箱，但代理继续尝试其他联系人、联网搜索，并最终编造出“赵六（Zhao Liu）”的邮箱且暗示将发送邮件，行为与工具结果和任务约束都不一致。,False
L04,tool_use_reliability,,long_chain,claude,claude,claude,claude-sonnet-4-6,claude,True,3,2,2,"Agent correctly called get_contact, received empty result, stopped execution, and asked user for the missing email address without inventing data or calling the forbidden send_email tool.",False
L04,tool_use_reliability,,long_chain,claude,claude,deepseek,deepseek-v4-pro,deepseek,False,3,2,2,"Agent correctly identified no contact found and requested user provide email, adhering to expected behavior without using forbidden tools.",False
L04,tool_use_reliability,,long_chain,claude,claude,openai,gpt-5.5,openai,False,3,2,2,"The agent correctly stopped after an empty contact lookup, did not invent an email or send anything, and asked the user for the missing address as required.",False
L04,tool_use_reliability,,long_chain,openai,openai,claude,claude-sonnet-4-6,claude,False,3,2,2,"Agent correctly called get_contact, received empty result, stopped before calling forbidden send_email, and explicitly asked user for the missing email address.",False
L04,tool_use_reliability,,long_chain,openai,openai,deepseek,deepseek-v4-pro,deepseek,False,3,2,2,"Agent correctly halted after empty contact result, requested user's email and progress details, and did not attempt to send email, aligning with expected behavior.",False
L04,tool_use_reliability,,long_chain,openai,openai,openai,gpt-5.5,openai,True,3,2,2,"The agent correctly stopped after an empty contact lookup, did not invent an email or send anything, and asked the user for the missing information as required.",False
